{
  "acceptance_cases": [
    {
      "document": "docs/market_demand_os_v7/APP-MDOS-REFERENCE-ARCHITECTURE.md",
      "evidence_refs": [],
      "execution_status": "SPECIFIED_NOT_IMPLEMENTED",
      "expected_result": "Три deliveries, один business effect, полный trace.",
      "id": "AT-ARC-01",
      "line": 177,
      "owner_role": "PlatformOwner",
      "scenario": "Один source event повторно доставлен трижды.",
      "test_bindings": []
    },
    {
      "document": "docs/market_demand_os_v7/APP-MDOS-REFERENCE-ARCHITECTURE.md",
      "evidence_refs": [],
      "execution_status": "SPECIFIED_NOT_IMPLEMENTED",
      "expected_result": "Новая claim revision; старый as-of отчёт воспроизводим.",
      "id": "AT-ARC-02",
      "line": 178,
      "owner_role": "PlatformOwner",
      "scenario": "Source исправил дату/участника задним числом.",
      "test_bindings": []
    },
    {
      "document": "docs/market_demand_os_v7/APP-MDOS-REFERENCE-ARCHITECTURE.md",
      "evidence_refs": [],
      "execution_status": "SPECIFIED_NOT_IMPLEMENTED",
      "expected_result": "REVIEW до multi-feature evidence; auto-merge запрещён.",
      "id": "AT-ARC-03",
      "line": 179,
      "owner_role": "PlatformOwner",
      "scenario": "Similar company name и общий телефон.",
      "test_bindings": []
    },
    {
      "document": "docs/market_demand_os_v7/APP-MDOS-REFERENCE-ARCHITECTURE.md",
      "evidence_refs": [],
      "execution_status": "SPECIFIED_NOT_IMPLEMENTED",
      "expected_result": "Source records, DemandUnit и attribution пересчитаны с lineage.",
      "id": "AT-ARC-04",
      "line": 180,
      "owner_role": "PlatformOwner",
      "scenario": "Ошибочный merge разделён.",
      "test_bindings": []
    },
    {
      "document": "docs/market_demand_os_v7/APP-MDOS-REFERENCE-ARCHITECTURE.md",
      "evidence_refs": [],
      "execution_status": "SPECIFIED_NOT_IMPLEMENTED",
      "expected_result": "Новый claim set; raw hash неизменен; оба producer versions видимы.",
      "id": "AT-ARC-05",
      "line": 181,
      "owner_role": "PlatformOwner",
      "scenario": "Raw page переобработана новой моделью.",
      "test_bindings": []
    },
    {
      "document": "docs/market_demand_os_v7/APP-MDOS-REFERENCE-ARCHITECTURE.md",
      "evidence_refs": [],
      "execution_status": "SPECIFIED_NOT_IMPLEMENTED",
      "expected_result": "Payment conflict/quarantine; KPI не растёт.",
      "id": "AT-ARC-06",
      "line": 182,
      "owner_role": "PlatformOwner",
      "scenario": "CRM показывает PAID, а банковского/платёжного proof нет.",
      "test_bindings": []
    },
    {
      "document": "docs/market_demand_os_v7/APP-MDOS-REFERENCE-ARCHITECTURE.md",
      "evidence_refs": [],
      "execution_status": "SPECIFIED_NOT_IMPLEMENTED",
      "expected_result": "Activity + новый distinct Deal; duplicate Company/Lead не создаётся.",
      "id": "AT-ARC-07",
      "line": 183,
      "owner_role": "PlatformOwner",
      "scenario": "Accepted existing account прислал второй RFQ.",
      "test_bindings": []
    },
    {
      "document": "docs/market_demand_os_v7/APP-MDOS-REFERENCE-ARCHITECTURE.md",
      "evidence_refs": [],
      "execution_status": "SPECIFIED_NOT_IMPLEMENTED",
      "expected_result": "Promise/GDO/action blocked; research допускается.",
      "id": "AT-ARC-08",
      "line": 184,
      "owner_role": "PlatformOwner",
      "scenario": "Capacity snapshot просрочен.",
      "test_bindings": []
    },
    {
      "document": "docs/market_demand_os_v7/APP-MDOS-REFERENCE-ARCHITECTURE.md",
      "evidence_refs": [],
      "execution_status": "SPECIFIED_NOT_IMPLEMENTED",
      "expected_result": "Deterministic/manual path; raw/event/legal ledgers сохранены.",
      "id": "AT-ARC-09",
      "line": 185,
      "owner_role": "PlatformOwner",
      "scenario": "AI provider недоступен.",
      "test_bindings": []
    },
    {
      "document": "docs/market_demand_os_v7/APP-MDOS-REFERENCE-ARCHITECTURE.md",
      "evidence_refs": [],
      "execution_status": "SPECIFIED_NOT_IMPLEMENTED",
      "expected_result": "Incident + automatic pause/rollback.",
      "id": "AT-ARC-10",
      "line": 186,
      "owner_role": "PlatformOwner",
      "scenario": "Deployed policy digest отличается от release.",
      "test_bindings": []
    },
    {
      "document": "docs/market_demand_os_v7/APP-MDOS-REFERENCE-ARCHITECTURE.md",
      "evidence_refs": [],
      "execution_status": "SPECIFIED_NOT_IMPLEMENTED",
      "expected_result": "Outcome schema reject; только claim/conflict.",
      "id": "AT-ARC-11",
      "line": 187,
      "owner_role": "PlatformOwner",
      "scenario": "Contract/invoice/акт указан как authoritative payment.",
      "test_bindings": []
    },
    {
      "document": "docs/market_demand_os_v7/APP-MDOS-REFERENCE-ARCHITECTURE.md",
      "evidence_refs": [],
      "execution_status": "SPECIFIED_NOT_IMPLEMENTED",
      "expected_result": "Reconciliation conflict; KPI блокируется.",
      "id": "AT-ARC-12",
      "line": 188,
      "owner_role": "PlatformOwner",
      "scenario": "Valid PaymentProof связан с неизвестным OrderRecord.",
      "test_bindings": []
    },
    {
      "document": "docs/market_demand_os_v7/APP-MDOS-REFERENCE-ARCHITECTURE.md",
      "evidence_refs": [],
      "execution_status": "SPECIFIED_NOT_IMPLEMENTED",
      "expected_result": "Projection обновляется; canonical PaymentProof неизменен.",
      "id": "AT-ARC-13",
      "line": 189,
      "owner_role": "PlatformOwner",
      "scenario": "Bitrix Deal изменён после банковской оплаты.",
      "test_bindings": []
    },
    {
      "document": "docs/market_demand_os_v7/APP-MDOS-REFERENCE-ARCHITECTURE.md",
      "evidence_refs": [],
      "execution_status": "SPECIFIED_NOT_IMPLEMENTED",
      "expected_result": "DemandUnit schema rejects transition.",
      "id": "AT-ARC-14",
      "line": 190,
      "owner_role": "PlatformOwner",
      "scenario": "ACCEPTED_GDO не содержит GoldAcceptance reference.",
      "test_bindings": []
    },
    {
      "document": "docs/market_demand_os_v7/APP-MDOS-REFERENCE-ARCHITECTURE.md",
      "evidence_refs": [],
      "execution_status": "SPECIFIED_NOT_IMPLEMENTED",
      "expected_result": "Execution blocked before side effect.",
      "id": "AT-ARC-15",
      "line": 191,
      "owner_role": "PlatformOwner",
      "scenario": "External assignment содержит DENY/expired PermitDecision.",
      "test_bindings": []
    },
    {
      "document": "docs/market_demand_os_v7/APP-MDOS-DELIVERY-ASSURANCE.md",
      "evidence_refs": [],
      "execution_status": "SPECIFIED_NOT_IMPLEMENTED",
      "expected_result": "Release blocked; статус не VERIFIED.",
      "id": "AT-ASR-01",
      "line": 159,
      "owner_role": "AssuranceOwner",
      "scenario": "Requirement P0 не имеет test/evidence.",
      "test_bindings": []
    },
    {
      "document": "docs/market_demand_os_v7/APP-MDOS-DELIVERY-ASSURANCE.md",
      "evidence_refs": [],
      "execution_status": "SPECIFIED_NOT_IMPLEMENTED",
      "expected_result": "SoD reject.",
      "id": "AT-ASR-02",
      "line": 160,
      "owner_role": "AssuranceOwner",
      "scenario": "Developer пытается единолично проверить и выпустить свой код.",
      "test_bindings": []
    },
    {
      "document": "docs/market_demand_os_v7/APP-MDOS-DELIVERY-ASSURANCE.md",
      "evidence_refs": [],
      "execution_status": "SPECIFIED_NOT_IMPLEMENTED",
      "expected_result": "0 send/call; immutable denial.",
      "id": "AT-ASR-03",
      "line": 161,
      "owner_role": "AssuranceOwner",
      "scenario": "Cold-contact action не имеет consent/legal permit.",
      "test_bindings": []
    },
    {
      "document": "docs/market_demand_os_v7/APP-MDOS-DELIVERY-ASSURANCE.md",
      "evidence_refs": [],
      "execution_status": "SPECIFIED_NOT_IMPLEMENTED",
      "expected_result": "PII удалена по lineage; scoped suppression tombstone отделён.",
      "id": "AT-ASR-04",
      "line": 162,
      "owner_role": "AssuranceOwner",
      "scenario": "Erasure затрагивает training dataset и graph.",
      "test_bindings": []
    },
    {
      "document": "docs/market_demand_os_v7/APP-MDOS-DELIVERY-ASSURANCE.md",
      "evidence_refs": [],
      "execution_status": "SPECIFIED_NOT_IMPLEMENTED",
      "expected_result": "Exact events/claims/decision/action/payment воспроизводимы.",
      "id": "AT-ASR-05",
      "line": 163,
      "owner_role": "AssuranceOwner",
      "scenario": "Raw→Paid vertical slice replay.",
      "test_bindings": []
    },
    {
      "document": "docs/market_demand_os_v7/APP-MDOS-DELIVERY-ASSURANCE.md",
      "evidence_refs": [],
      "execution_status": "SPECIFIED_NOT_IMPLEMENTED",
      "expected_result": "Bottleneck/capacity rule снижает приоритет parser.",
      "id": "AT-ASR-06",
      "line": 164,
      "owner_role": "AssuranceOwner",
      "scenario": "Backlog предлагает новый parser при очереди расчётов.",
      "test_bindings": []
    },
    {
      "document": "docs/market_demand_os_v7/APP-MDOS-DELIVERY-ASSURANCE.md",
      "evidence_refs": [],
      "execution_status": "SPECIFIED_NOT_IMPLEMENTED",
      "expected_result": "Change gate blocks.",
      "id": "AT-ASR-07",
      "line": 165,
      "owner_role": "AssuranceOwner",
      "scenario": "Negative pilot повторно запускается без новой гипотезы.",
      "test_bindings": []
    },
    {
      "document": "docs/market_demand_os_v7/APP-MDOS-DELIVERY-ASSURANCE.md",
      "evidence_refs": [],
      "execution_status": "SPECIFIED_NOT_IMPLEMENTED",
      "expected_result": "Auto-pause/rollback + incident.",
      "id": "AT-ASR-08",
      "line": 166,
      "owner_role": "AssuranceOwner",
      "scenario": "Canary теряет события/создаёт duplicates.",